{
  "tarea_id": "2026-10-escanos-lista-estudiantil-serbia",
  "fecha": "2026-10-26T17:06:53Z",
  "rub01": {
    "version_rubrica": "4.0",
    "criterios": {
      "genuino": {
        "puntaje": 2,
        "justificacion": "La tarea plantea una necesidad real: publicar una estimación esa misma noche. No entrega ninguna regla de reparto ni modelo para convertir votos en escaños.",
        "cita": "un medio que quiere publicar esa misma noche cuántos escaños tendría cada bando y si la lista estudiantil podría formar gobierno sin aliados"
      },
      "abierta": {
        "puntaje": 2,
        "justificacion": "La pregunta no prescribe procedimiento. Admite varios modelos defendibles: proporción simple, reparto con umbral, método de cocientes o escenarios para las mesas restantes. Tampoco hay instrucciones posteriores que encaucen la ruta.",
        "cita": "¿Qué estimación publicarían y con qué grado de seguridad? Pueden pedir información adicional."
      },
      "decisiones": {
        "puntaje": 2,
        "justificacion": "Resolver exige varias decisiones de modelación: suponer el umbral y el método de reparto, decidir cómo tratar el 8 % restante de votos y las mesas sin contar, y estimar la incertidumbre.",
        "cita": "El porcentaje exacto es parte de lo que el equipo debe averiguar o suponer."
      },
      "realismo": {
        "puntaje": 2,
        "justificacion": "Proyectar escaños a partir de un conteo parcial es una práctica real de los equipos de datos de los medios en noches electorales.",
        "cita": "Ustedes son parte del equipo de datos de un medio que quiere publicar esa misma noche cuántos escaños tendría cada bando"
      },
      "autenticidad": {
        "puntaje": 2,
        "justificacion": "El tema y las cifras del conteo parcial provienen de un hecho noticioso informado por la comisión electoral, y son el núcleo de la tarea. Según la regla, se toma como cierta la procedencia declarada.",
        "cita": "Cuando la comisión electoral había contado el 97 % de las mesas, informó 2,25 millones de votos para la lista de los estudiantes"
      },
      "contexto": {
        "puntaje": 2,
        "justificacion": "El contexto condiciona decisiones clave: el umbral, la mayoría de 126 escaños y las mesas faltantes. También es necesario para interpretar si hay gobierno sin aliados y para juzgar el grado de seguridad.",
        "cita": "para recibir escaños, una lista debe superar un porcentaje mínimo de los votos válidos; las listas que no lo superan quedan fuera del reparto"
      },
      "ciclo": {
        "puntaje": 2,
        "justificacion": "Responder obliga a recorrer todo el ciclo: comprender el sistema electoral, simplificar con supuestos, matematizar el reparto, calcular, interpretar respecto de la mayoría y juzgar la seguridad. Ninguna fase queda hecha en el enunciado.",
        "cita": "¿Qué estimación publicarían y con qué grado de seguridad?"
      },
      "validacion": {
        "puntaje": 2,
        "justificacion": "Existe evidencia independiente, no usada en la construcción del modelo, para contrastar la estimación: el resultado oficial final (R5).",
        "cita": "Cuando el grupo entregue su estimación, se le muestra el reparto final oficial de escaños publicado por la comisión electoral."
      },
      "nivel": {
        "puntaje": 2,
        "justificacion": "El contexto electoral y el lenguaje son comprensibles para S. La matemática requerida (porcentajes, razones, reparto proporcional, comparación de escenarios) está al alcance de las herramientas esperables del nivel.",
        "cita": "El parlamento tiene 250 escaños."
      },
      "autodiferenciacion": {
        "puntaje": 2,
        "justificacion": "El piso es accesible: un reparto proporcional simple con los votos dados. El techo es alto, porque la tarea misma admite soluciones más refinadas: umbral, método de cocientes, escenarios para el 3 % restante y análisis de sensibilidad del margen respecto de la mayoría.",
        "cita": "Pueden pedir información adicional."
      },
      "fecundidad": {
        "puntaje": 2,
        "justificacion": "Los distintos supuestos producen proyecciones distintas, lo que permite comparar soluciones. La tarea abre preguntas sobre umbrales, métodos de reparto, la prima de escaños de los partidos grandes y los límites de proyectar con datos incompletos.",
        "cita": "si la lista estudiantil podría formar gobierno sin aliados"
      },
      "recursos": {
        "puntaje": 2,
        "justificacion": "La información necesaria se entrega de entrada o a solicitud (R1–R4), sin revelar el método de reparto. El umbral y el sistema electoral pueden obtenerse con una búsqueda simple o suponerse, como indica R3.",
        "cita": "Según cifras preliminares, la lista de los estudiantes tiene 52,7 % de los votos y el Partido Progresista Serbio (SNS) tiene 39,2 %."
      }
    },
    "total": 24,
    "mejoras": []
  },
  "reproducibilidad": {
    "agentes": {
      "disenador": {
        "modelo": "claude-sonnet-5-5",
        "version_modelo": "claude-sonnet-5-5",
        "costo_usd": 0.330588,
        "version_prompt": "1.1"
      },
      "evaluador": {
        "modelo": "claude-opus-5-5",
        "version_modelo": "claude-opus-5-5",
        "costo_usd": 0.250984,
        "version_prompt": "1.3"
      },
      "filtro": {
        "modelo": "claude-haiku-5-5",
        "version_modelo": "claude-haiku-5-5",
        "costo_usd": 0.000754,
        "version_prompt": "1.0"
      },
      "ilustrador": {
        "modelo": "claude-sonnet-5-5",
        "version_modelo": "claude-sonnet-5-5",
        "costo_usd": 0.010606,
        "version_prompt": "1.0"
      },
      "redactor": {
        "modelo": "claude-sonnet-5-5",
        "version_modelo": "claude-sonnet-5-5",
        "costo_usd": 0.142909,
        "version_prompt": "1.0"
      },
      "redactor_escenarios": {
        "modelo": "claude-opus-5-5",
        "version_modelo": "claude-opus-5-5",
        "costo_usd": 0.34407,
        "version_prompt": "1.0"
      },
      "simulador": {
        "modelo": "claude-sonnet-5-5",
        "version_modelo": "claude-sonnet-5-5",
        "costo_usd": 0.51128,
        "version_prompt": "PROMPTS.md"
      },
      "simulador_codificador": {
        "modelo": "claude-opus-5-5",
        "version_modelo": "claude-opus-5-5",
        "costo_usd": 0.355232,
        "version_prompt": "PROMPTS.md"
      },
      "verificador": {
        "modelo": "claude-opus-5-5",
        "version_modelo": "claude-opus-5-5",
        "costo_usd": 0.119176,
        "version_prompt": "1.1"
      }
    },
    "version_prompt": {
      "disenador": "1.1",
      "evaluador": "1.3",
      "filtro": "1.0",
      "ilustrador": "1.0",
      "redactor": "1.0",
      "redactor_escenarios": "1.0",
      "simulador": "PROMPTS.md",
      "simulador_codificador": "PROMPTS.md",
      "verificador": "1.1"
    },
    "version_rubrica": "4.0",
    "version_MAR03": "1.0",
    "version_MED01": "1.4",
    "diseno_simulador": "diseno_otm",
    "fecha": "2026-10-26T19:39:05Z",
    "costo_usd": 2.065599
  }
}
