{
  "tarea_id": "2026-10-que-tan-renida-fue",
  "fecha": "2026-10-26T15:14:04Z",
  "rub01": {
    "version_rubrica": "4.0",
    "criterios": {
      "genuino": {
        "puntaje": 2,
        "justificacion": "La tarea plantea una necesidad real: dirimir si la elección fue pareja o clara para una nota de prensa. No entrega ninguna regla ni criterio para medir qué tan reñida fue.",
        "cita": "deben escribir una nota breve que explique qué tan reñida fue esta elección y cómo lo saben"
      },
      "abierta": {
        "puntaje": 2,
        "justificacion": "Hay varios caminos defendibles: diferencia de votos, diferencia en puntos porcentuales, votos que habría que cambiar o comparación con la elección anterior. La pregunta no prescribe ningún procedimiento.",
        "cita": "Decidan qué comparaciones hacer y qué datos les sirven para apoyar su opinión."
      },
      "decisiones": {
        "puntaje": 2,
        "justificacion": "Resolver exige definir qué significa «reñida» y elegir qué medida y qué referencia usar. También se puede decidir si solicitar información adicional (elección anterior, tratamiento de blancos y nulos).",
        "cita": "¿Fue una elección pareja o clara? Pueden pedir información adicional."
      },
      "realismo": {
        "puntaje": 2,
        "justificacion": "El debate público sobre la estrechez de un resultado electoral es una situación que existe fuera de la escuela, y la nota de un diario escolar es plausible.",
        "cita": "En un programa de radio, una persona dijo que fue una elección muy pareja y otra dijo que Lula ganó con claridad."
      },
      "autenticidad": {
        "puntaje": 2,
        "justificacion": "Los resultados electorales y el tema son componentes extraescolares no creados para enseñar, y constituyen el núcleo de la tarea. La verificación de la fuente corresponde a otro agente.",
        "cita": "Lula obtuvo 64.256.232 votos, que son el 51,79 % de los votos. Flávio Bolsonaro obtuvo 59.826.041 votos, el 48,21 %."
      },
      "contexto": {
        "puntaje": 2,
        "justificacion": "El contexto electoral condiciona qué medida tiene sentido usar. También es necesario para interpretar si una diferencia de unos 4,4 millones de votos o 3,58 puntos es «pareja» o «clara».",
        "cita": "una persona dijo que fue una elección muy pareja y otra dijo que Lula ganó con claridad"
      },
      "ciclo": {
        "puntaje": 2,
        "justificacion": "Responder exige recorrer todas las fases: comprender la disputa, elegir un criterio de comparación, calcular diferencias o proporciones y volver a la situación para juzgar y justificar la respuesta. Ninguna fase queda hecha por el enunciado.",
        "cita": "escribir una nota breve que explique qué tan reñida fue esta elección y cómo lo saben"
      },
      "validacion": {
        "puntaje": 2,
        "justificacion": "El juicio sobre qué tan reñida fue puede contrastarse con evidencia independiente. Sirven la elección anterior (50,9 % vs 49,1 %) u otras elecciones públicas, no usadas para construir la medida.",
        "cita": "R2 (Resultado de la elección presidencial anterior, como punto de comparación)"
      },
      "nivel": {
        "puntaje": 2,
        "justificacion": "El contexto y el lenguaje son comprensibles para 10–12 años. La matemática requerida (restas, porcentajes simples, comparación de cantidades grandes) está dentro de las herramientas esperables en P.",
        "cita": "Ustedes forman el equipo de datos de un diario escolar"
      },
      "autodiferenciacion": {
        "puntaje": 2,
        "justificacion": "El piso es bajo, porque basta restar votos o porcentajes. El techo admite soluciones más sofisticadas: votos que habría que trasladar para empatar, diferencia relativa o comparación con elecciones anteriores.",
        "cita": "Decidan qué comparaciones hacer y qué datos les sirven para apoyar su opinión."
      },
      "fecundidad": {
        "puntaje": 2,
        "justificacion": "Las distintas medidas pueden llevar a conclusiones diferentes y permiten comparar soluciones. Además abren preguntas sobre qué umbral define una elección reñida o cómo cambia el juicio con blancos y nulos.",
        "cita": "¿Fue una elección pareja o clara?"
      },
      "recursos": {
        "puntaje": 2,
        "justificacion": "La información necesaria está dada o disponible a solicitud (R2, R3), y ningún material indica qué comparación hacer ni revela el criterio de solución.",
        "cita": "Dibujo sencillo de una urna de votación y, al lado, dos barras horizontales de colores distintos, sin números."
      }
    },
    "total": 24,
    "mejoras": []
  },
  "reproducibilidad": {
    "agentes": {
      "disenador": {
        "modelo": "claude-sonnet-5-5",
        "version_modelo": "claude-sonnet-5-5",
        "costo_usd": 0.137039,
        "version_prompt": "1.1"
      },
      "evaluador": {
        "modelo": "claude-opus-5-5",
        "version_modelo": "claude-opus-5-5",
        "costo_usd": 0.254436,
        "version_prompt": "1.3"
      },
      "filtro": {
        "modelo": "claude-haiku-5-5",
        "version_modelo": "claude-haiku-5-5",
        "costo_usd": 0.000732,
        "version_prompt": "1.0"
      },
      "ilustrador": {
        "modelo": "claude-sonnet-5-5",
        "version_modelo": "claude-sonnet-5-5",
        "costo_usd": 0.006008,
        "version_prompt": "1.0"
      },
      "redactor": {
        "modelo": "claude-sonnet-5-5",
        "version_modelo": "claude-sonnet-5-5",
        "costo_usd": 0.119986,
        "version_prompt": "1.0"
      },
      "redactor_escenarios": {
        "modelo": "claude-opus-5-5",
        "version_modelo": "claude-opus-5-5",
        "costo_usd": 0.191186,
        "version_prompt": "1.0"
      },
      "simulador": {
        "modelo": "claude-sonnet-5-5",
        "version_modelo": "claude-sonnet-5-5",
        "costo_usd": 0.783779,
        "version_prompt": "PROMPTS.md"
      },
      "simulador_codificador": {
        "modelo": "claude-opus-5-5",
        "version_modelo": "claude-opus-5-5",
        "costo_usd": 0.452636,
        "version_prompt": "PROMPTS.md"
      },
      "verificador": {
        "modelo": "claude-opus-5-5",
        "version_modelo": "claude-opus-5-5",
        "costo_usd": 0.102732,
        "version_prompt": "1.1"
      }
    },
    "version_prompt": {
      "disenador": "1.1",
      "evaluador": "1.3",
      "filtro": "1.0",
      "ilustrador": "1.0",
      "redactor": "1.0",
      "redactor_escenarios": "1.0",
      "simulador": "PROMPTS.md",
      "simulador_codificador": "PROMPTS.md",
      "verificador": "1.1"
    },
    "version_rubrica": "4.0",
    "version_MAR03": "1.0",
    "version_MED01": "1.4",
    "diseno_simulador": "diseno_otm",
    "fecha": "2026-10-26T19:32:56Z",
    "costo_usd": 2.048534
  }
}
