{
  "tarea_id": "2026-10-cuanto-pagar-cada-mes-v2",
  "fecha": "2026-10-26T18:19:18Z",
  "rub01": {
    "version_rubrica": "4.0",
    "criterios": {
      "genuino": {
        "puntaje": 2,
        "justificacion": "La tarea plantea una necesidad de decisión real y no entrega ninguna regla ni modelo. El criterio de conveniencia, como la capacidad de pago o el total pagado, debe construirlo el grupo.",
        "cita": "¿Qué le conviene más a esa persona: el convenio antiguo o el nuevo, con pie o sin pie? Expliquen su decisión."
      },
      "abierta": {
        "puntaje": 2,
        "justificacion": "La pregunta no prescribe procedimiento y admite varios caminos defendibles. Según el monto, los ingresos supuestos y el criterio elegido, se puede llegar a distintas conclusiones.",
        "cita": "Imaginen a una persona que tiene una deuda del CAE cuyo monto ustedes eligen como ejemplo."
      },
      "decisiones": {
        "puntaje": 2,
        "justificacion": "Resolver exige suponer el monto de la deuda y la capacidad de pago, decidir si considerar intereses y definir qué significa «convenir». Son decisiones de modelación sustantivas.",
        "cita": "el grupo puede elegir un ejemplo y justificarlo. No hay un único monto correcto."
      },
      "realismo": {
        "puntaje": 2,
        "justificacion": "La situación de elegir un convenio de pago de una deuda CAE con o sin pie existe fuera de la escuela.",
        "cita": "Tesorería, el organismo del Estado que cobra esas deudas, ofrece convenios de pago"
      },
      "autenticidad": {
        "puntaje": 2,
        "justificacion": "Las condiciones reales del convenio (24 y 48 cuotas, el pie) y el simulador de Tesorería del R6 son componentes extraescolares no creados para enseñar. Están integrados como núcleo de la tarea.",
        "cita": "Ahora los deudores del CAE pueden elegir un convenio de 48 cuotas."
      },
      "contexto": {
        "puntaje": 2,
        "justificacion": "El contexto condiciona las decisiones, porque la conveniencia depende de la situación de la persona. Además es necesario para interpretar el resultado: la misma cuota puede ser conveniente o no según el caso.",
        "cita": "lo que una persona puede pagar cada mes depende de sus ingresos y de sus otros gastos"
      },
      "ciclo": {
        "puntaje": 2,
        "justificacion": "Responder obliga a comprender la situación, simplificar (monto, intereses, capacidad de pago), calcular las cuotas, interpretar cuál conviene y contrastar con el simulador. El enunciado no deja hecha ninguna fase; las simplificaciones solo se entregan si el grupo las solicita.",
        "cita": "Expliquen su decisión. Pueden pedir información adicional."
      },
      "validacion": {
        "puntaje": 2,
        "justificacion": "Existe evidencia independiente, no usada en la construcción del modelo, para contrastar la cuota calculada. Esa comparación también permite ver los límites del supuesto sin intereses.",
        "cita": "el docente entrega la cuota que muestra el simulador de convenios de Tesorería para la misma deuda que el grupo eligió"
      },
      "nivel": {
        "puntaje": 1,
        "justificacion": "La matemática (división y 10%) está al alcance de las herramientas del nivel P. Sin embargo, un crédito universitario, los convenios con Tesorería y el «pie al contado» son comprensibles pero poco significativos para estudiantes de 10 a 12 años. Hay duda entre 1 y 2, y se asigna el menor.",
        "cita": "Muchas personas pidieron un crédito para estudiar en la educación superior, llamado CAE, y todavía lo están pagando."
      },
      "autodiferenciacion": {
        "puntaje": 2,
        "justificacion": "El piso es bajo: basta elegir un monto redondo y dividir. La tarea admite además soluciones más sofisticadas, como comparar varios montos, relacionar la cuota con ingresos y gastos, variar el pie o generalizar un criterio.",
        "cita": "Imaginen a una persona que tiene una deuda del CAE cuyo monto ustedes eligen como ejemplo."
      },
      "fecundidad": {
        "puntaje": 2,
        "justificacion": "Los grupos que eligen montos e ingresos distintos pueden comparar soluciones. El contraste con el simulador abre preguntas nuevas, como por qué la cuota real difiere, el efecto de los intereses y cuánto pie conviene.",
        "cita": "¿Qué le conviene más a esa persona: el convenio antiguo o el nuevo, con pie o sin pie?"
      },
      "recursos": {
        "puntaje": 2,
        "justificacion": "La información necesaria está en el enunciado o puede solicitarse (R4, R5, R6). Los datos de monto e ingreso los elige el grupo, y ningún material revela cómo decidir qué conviene.",
        "cita": "Pueden pedir información adicional."
      }
    },
    "total": 23,
    "mejoras": [
      {
        "criterio": "nivel",
        "mejora_minima": "Presentar a la persona como un familiar cercano del estudiante (por ejemplo, una hermana mayor o un tío) que debe decidir cómo pagar. Explicar en palabras simples qué es un «convenio» y un «pie»."
      }
    ]
  },
  "reproducibilidad": {
    "agentes": {
      "disenador": {
        "modelo": "claude-sonnet-5-5",
        "version_modelo": "claude-sonnet-5-5",
        "costo_usd": 0.164283,
        "version_prompt": "1.1"
      },
      "evaluador": {
        "modelo": "claude-opus-5-5",
        "version_modelo": "claude-opus-5-5",
        "costo_usd": 0.342852,
        "version_prompt": "1.3"
      },
      "filtro": {
        "modelo": "claude-haiku-5-5",
        "version_modelo": "claude-haiku-5-5",
        "costo_usd": 0.000727,
        "version_prompt": "1.0"
      },
      "ilustrador": {
        "modelo": "claude-sonnet-5-5",
        "version_modelo": "claude-sonnet-5-5",
        "costo_usd": 0.013788,
        "version_prompt": "1.0"
      },
      "redactor": {
        "modelo": "claude-sonnet-5-5",
        "version_modelo": "claude-sonnet-5-5",
        "costo_usd": 0.288093,
        "version_prompt": "1.0"
      },
      "redactor_escenarios": {
        "modelo": "claude-opus-5-5",
        "version_modelo": "claude-opus-5-5",
        "costo_usd": 0.755302,
        "version_prompt": "1.0"
      },
      "simulador": {
        "modelo": "claude-sonnet-5-5",
        "version_modelo": "claude-sonnet-5-5",
        "costo_usd": 0.777407,
        "version_prompt": "INS09"
      },
      "simulador_codificador": {
        "modelo": "claude-opus-5-5",
        "version_modelo": "claude-opus-5-5",
        "costo_usd": 0.44914,
        "version_prompt": "INS09"
      }
    },
    "version_prompt": {
      "disenador": "1.1",
      "evaluador": "1.3",
      "filtro": "1.0",
      "ilustrador": "1.0",
      "redactor": "1.0",
      "redactor_escenarios": "1.0",
      "simulador": "INS09",
      "simulador_codificador": "INS09"
    },
    "version_rubrica": "4.0",
    "version_MAR03": "1.0",
    "version_MED01": "1.4",
    "diseno_simulador": null,
    "fecha": "2026-10-26T18:19:18Z",
    "costo_usd": 2.791592
  }
}
