{
  "tarea_id": "2026-10-pagar-trasladar-o-esperar",
  "fecha": "2026-10-20T20:28:14Z",
  "rub01": {
    "version_rubrica": "4.0",
    "criterios": {
      "genuino": {
        "puntaje": 2,
        "justificacion": "Plantea una necesidad real de decisión y no entrega regla, fórmula ni modelo de decisión. El título sugiere tres opciones, pero no la estructura del análisis.",
        "cita": "La gerencia debe decidir cómo fijar los precios a sus clientes y cómo manejar sus contratos en los próximos meses."
      },
      "abierta": {
        "puntaje": 2,
        "justificacion": "La pregunta no prescribe procedimiento. Admite varios modelos defendibles: escenarios, árbol de decisión, valor esperado o análisis de traspaso de precios, y no hay instrucciones posteriores que encaucen.",
        "cita": "¿qué estrategia recomendarían a la gerencia y qué tan segura es esa recomendación? Pueden pedir información adicional."
      },
      "decisiones": {
        "puntaje": 2,
        "justificacion": "Resolver exige suponer probabilidades y plazos del juicio, estimar elasticidad y margen, y solicitar información concreta a la gerencia (R4).",
        "cita": "Nadie sabe cuándo ni cómo terminará el caso."
      },
      "realismo": {
        "puntaje": 2,
        "justificacion": "La situación es un conflicto comercial y judicial real. La decisión de precios de una importadora es claramente plausible fuera de la escuela.",
        "cita": "Un grupo de defensa de empresas estadounidenses demandó al gobierno por los nuevos aranceles a productos canadienses."
      },
      "autenticidad": {
        "puntaje": 2,
        "justificacion": "El tema y los datos provienen de un hecho extraescolar real (la demanda y los aranceles) y son el núcleo de la tarea. R5 suma series oficiales públicas. Hay una duda menor porque la tarea no cita explícitamente su fuente periodística, pero el contenido auténtico está integrado sustantivamente.",
        "cita": "El gobierno grava bienes canadienses por un valor aproximado de $20bn."
      },
      "contexto": {
        "puntaje": 2,
        "justificacion": "El contexto (tipos de contrato, devolución con intereses, competencia y margen estrecho) condiciona las decisiones del modelo. También es necesario para interpretar y juzgar la seguridad de la recomendación.",
        "cita": "Sus contratos con clientes pueden ser de precio fijo por un periodo o de precio ajustable."
      },
      "ciclo": {
        "puntaje": 2,
        "justificacion": "Responder obliga a comprender la situación, simplificar la incertidumbre, matematizar, calcular, interpretar la recomendación y validarla contra datos. Ninguna fase viene hecha.",
        "cita": "El grupo debe indicar qué variable y qué periodo quiere comparar con lo que predijo su modelo."
      },
      "validacion": {
        "puntaje": 2,
        "justificacion": "El modelo puede contrastarse con evidencia independiente no usada en su construcción, entregada después de fijar la recomendación.",
        "cita": "Existen series públicas de precios al consumidor y de volúmenes importados de queso, publicadas por organismos oficiales de estadísticas."
      },
      "nivel": {
        "puntaje": 2,
        "justificacion": "El contexto es comprensible y pertinente para universitarios. La decisión bajo incertidumbre requiere probabilidad, optimización y sensibilidad, herramientas esperables del nivel U.",
        "cita": "¿qué estrategia recomendarían a la gerencia y qué tan segura es esa recomendación?"
      },
      "autodiferenciacion": {
        "puntaje": 2,
        "justificacion": "Se puede entrar con una comparación aritmética de dos o tres escenarios. La tarea misma admite modelos mucho más sofisticados (árboles de decisión, elasticidad, descuento por intereses, sensibilidad).",
        "cita": "Ustedes son el equipo asesor: ¿qué estrategia recomendarían a la gerencia y qué tan segura es esa recomendación?"
      },
      "fecundidad": {
        "puntaje": 2,
        "justificacion": "Las decisiones abren preguntas sobre quién absorbe el arancel, el valor de esperar y el riesgo contractual. Permiten comparar estrategias y discutir límites del modelo.",
        "cita": "Los demandantes piden que, si ganan, se devuelva lo pagado con intereses, y que se frene el cobro mientras dura el juicio."
      },
      "recursos": {
        "puntaje": 2,
        "justificacion": "La información necesaria puede solicitarse o estimarse sin que los materiales revelen el modelo. R5 se entrega solo tras fijar la recomendación.",
        "cita": "La gerencia entrega órdenes de magnitud solo si el grupo pregunta por una variable concreta."
      }
    },
    "total": 24,
    "mejoras": []
  },
  "reproducibilidad": {
    "agentes": {
      "disenador": {
        "modelo": "claude-sonnet-5-5",
        "version_modelo": "claude-sonnet-5-5",
        "costo_usd": 0.476049,
        "version_prompt": "1.0"
      },
      "evaluador": {
        "modelo": "claude-opus-5-5",
        "version_modelo": "claude-opus-5-5",
        "costo_usd": 0.20889,
        "version_prompt": "1.3"
      },
      "filtro": {
        "modelo": "claude-haiku-5-5",
        "version_modelo": "claude-haiku-5-5",
        "costo_usd": 0.00037,
        "version_prompt": "1.0"
      },
      "ilustrador": {
        "modelo": "claude-sonnet-5-5",
        "version_modelo": "claude-sonnet-5-5",
        "costo_usd": 0.01105,
        "version_prompt": "1.0"
      },
      "redactor": {
        "modelo": "claude-sonnet-5-5",
        "version_modelo": "claude-sonnet-5-5",
        "costo_usd": 0.142011,
        "version_prompt": "1.0"
      },
      "redactor_escenarios": {
        "modelo": "claude-opus-5-5",
        "version_modelo": "claude-opus-5-5",
        "costo_usd": 0.19644,
        "version_prompt": "1.0"
      },
      "simulador": {
        "modelo": "claude-sonnet-5-5",
        "version_modelo": "claude-sonnet-5-5",
        "costo_usd": 0.49023,
        "version_prompt": "PROMPTS.md"
      },
      "simulador_codificador": {
        "modelo": "claude-opus-5-5",
        "version_modelo": "claude-opus-5-5",
        "costo_usd": 0.398292,
        "version_prompt": "PROMPTS.md"
      },
      "verificador": {
        "modelo": "claude-opus-5-5",
        "version_modelo": "claude-opus-5-5",
        "costo_usd": 0.120483,
        "version_prompt": "1.0"
      }
    },
    "version_prompt": {
      "disenador": "1.0",
      "evaluador": "1.3",
      "filtro": "1.0",
      "ilustrador": "1.0",
      "redactor": "1.0",
      "redactor_escenarios": "1.0",
      "simulador": "PROMPTS.md",
      "simulador_codificador": "PROMPTS.md",
      "verificador": "1.0"
    },
    "version_rubrica": "4.0",
    "version_MAR03": "1.0",
    "version_MED01": "1.1",
    "diseno_simulador": "diseno_otm",
    "fecha": "2026-10-20T21:22:45Z",
    "costo_usd": 2.043815
  }
}
